{
  "id": "kdf",
  "faction": "kdf",
  "name": "KDF",
  "menu": [
    "mbt_lavi",
    "ifv_namer",
    "apc_eitan",
    "inf_squad",
    "at_team",
    "mortar_team",
    "jeep_shoded",
    "recon_drone",
    "dozer_d9",
    "heli_peten",
    "yahalom_squad",
    "inf_medic_squad"
  ],
  "pop_cap": 40,
  "budget": {
    "logistics_start": 1500,
    "status": "provisional"
  }
}
